route_key,phase_key,phase_order,name,short_name,description,goal_text,spoiler_level,is_optional,source_key,notes
fighter_op_fast_manual,phase_01_start_op,10,Fase 1 - Start naar Vernworth,Start,Borderwatch via Melve naar Vernworth met minimale omwegen.,Vernworth bereiken en Melve als vroeg routeanker vastzetten.,1,0,own_playthrough,Sprint 4B Act 1 routefase.
fighter_op_fast_manual,phase_02_vernworth_power_base,20,Fase 2 - Vernworth power base,Vernworth,"Vernworth gebruiken als hub voor Brant, winkels, vocation guild, opslag en oxcart.",Hubregels instellen voordat de route vertakt.,1,0,own_playthrough,Sprint 4B Act 1 routefase.
fighter_op_fast_manual,phase_03_vocation_unlocks,30,Fase 3 - Trevo + Warrior/Sorcerer,Trevo,Monster Culling slim combineren met Vocation Frustration.,Monster Culling afronden en Warrior/Sorcerer ontgrendelen.,2,0,game8,Sprint 4B Act 1 routefase.
fighter_op_fast_manual,phase_04_vernworth_act1_mainline,40,Fase 4 - Brant Act 1 mainline,Brant,"Disa, Magistrate, Nameless Village, masquerade en Allard-lijn in lage-backtracking volgorde.",Alle benodigde Act 1 Brant-taken afronden.,2,0,game8,Sprint 4B Act 1 routefase.
fighter_op_fast_manual,phase_05_pre_coronation_sweep,50,Fase 5 - Pre-coronation sweep,Pre-Feast,Missable en hoge-waarde sidequests checken voordat Feast of Deception start.,Geen belangrijke Act 1-zaken verliezen.,2,0,game8,Sprint 4B Act 1 routefase.
fighter_op_fast_manual,phase_06_act1_boundary,60,Fase 6 - Feast en Act 1 einde,Feast,Feast of Deception veilig starten en Act 1 afsluiten richting Battahl.,Nation of the Lambent Flame / Battahl-route klaarzetten.,2,0,game8,Sprint 4B Act 1 routefase.
fighter_op_fast_manual,phase_07_battahl_access,70,Fase 7 - Battahl toegang,Battahl,"Placeholder voor Sprint 4D: Checkpoint Rest Town, Bakbattahl en power spike.",Volgende sprint.,2,0,own_playthrough,Future routefase.
fighter_op_fast_manual,phase_08_late_op_route,80,Fase 8 - Endgame/late OP route,Late OP,Placeholder voor Sprint 4E/4F.,Volgende sprint.,3,0,own_playthrough,Future routefase.
