route_key,objective_key,decision_key,sort_order,question,recommended_choice,fast_route_advice,completionist_advice,skip_advice,spoiler_level,source_key,notes
fighter_op_fast_manual,obj_start_borderwatch,spoiler_mode,10,Spoilerroute aanzetten?,"Ja, voor deze OP-route wel.",Zet spoilers aan zodat de app exacte loot/queststappen mag tonen.,"Je kunt later low-spoiler profielen gebruiken, maar deze route is bewust exact.",Niet overslaan: zonder spoilers wordt de OP-route te vaag.,0,own_playthrough,UI-beslissing voor route-profiel.
fighter_op_fast_manual,obj_visit_melve,melve_side_content,10,Sidequests in Melve nu doen?,Alleen doen wat de route vraagt.,Voor OP Fast: blijf op het pad richting Vernworth en voorkom vroege zijpaden.,Completionist kan Melve later uitgebreider leegmaken wanneer fast travel/gear beter is.,Sla lange omwegen nu over.,1,own_playthrough,Voorkomt onnodige backtracking in act 1.
fighter_op_fast_manual,obj_clear_trevo_mine,optional_trevo_loot,10,Alle loot in Trevo Mine pakken?,Pak verplichte wapens; pak extra loot alleen als die direct op je pad ligt.,Prioriteit: Two-Hander en Grievous Horns. Geen lange backtracking door zijgangen.,Completionist kan de mijn vollediger schoonmaken.,Fast route: laat verre/gevaarlijke loot liggen.,1,own_playthrough,Route-keuze binnen dungeon.
fighter_op_fast_manual,obj_unlock_warrior_sorcerer,switch_vocation_after_unlock,10,Na unlock meteen wisselen van vocation?,Wissel alleen als je routevariant dat wil.,"Fighter OP Fast kan door, Warrior/Sorcerer profielen krijgen hier hogere prioriteit.",Completionist kan beide vocations direct ranken.,Niet verplicht voor Fighter-route.,1,own_playthrough,Voorbereiding op vocation variants.
fighter_op_fast_manual,obj_first_op_milestone,next_route_branch,10,Wat is de volgende routefase?,Kies daarna All Vocations Unlock of Battahl power spike.,"Fast route: ga naar de volgende concrete power spike, niet naar losse collectibles.",Completionist kan nu extra Vernworth/Melve content afvinken.,Sla losse sidequests zonder OP-beloning voorlopig over.,1,own_playthrough,Einde Sprint 4A/Fighter Act 1 basisfase.
